{
  "version": "1.0.0",
  "workflow": {
    "name": "Test Workflow",
    "workflowRid": "ri.taurus.main.workflow.test-workflow-123",
    "objectType": {
      "id": "test.object-type",
      "dynamicLookup": false,
      "properties": [
        { "id": "property_a", "type": "string", "description": "Test property A" },
        { "id": "property_b", "type": "number", "description": "Test property B" },
        { "id": "property_c", "type": "boolean", "description": "Test property C" }
      ]
    },
    "output": {
      "id": "output-123",
      "version": "1.0.0",
      "parameters": [
        { "id": "result", "type": "string", "defaultValue": "pending" }
      ]
    }
  },
  "foundry": {
    "url": "https://test.palantirfoundry.com",
    "ontologyRid": "ri.ontology.main.ontology.test-ontology-123",
    "tokenEnvVar": "TEST_FOUNDRY_TOKEN"
  },
  "sdk": {
    "packageName": "@test/sdk",
    "archetypes": {
      "proposal": "TestProposalArchetype",
      "rule": "TestRuleArchetype"
    },
    "actions": {
      "createProposal": "test-create-proposal",
      "approveProposal": "test-approve-proposal",
      "rejectProposal": "test-reject-proposal",
      "editProposal": "test-edit-proposal"
    }
  },
  "validation": {
    "grammarVersion": "V1",
    "supportedStrategyTypes": ["filterNode"],
    "supportedStringFilters": ["EQUALS", "CONTAINS"],
    "unsupportedStringFilters": ["REGEX"],
    "supportedNumericFilters": ["EQUALS", "GREATER_THAN", "LESS_THAN"],
    "supportedNullFilters": ["NULL", "NOT_NULL"]
  },
  "conventions": {
    "proposalIdPrefix": "TEST-PROP-",
    "ruleIdPrefix": "TEST-RULE-",
    "defaultAuthor": "test-author",
    "defaultDescription": "Test description",
    "defaultKeywords": "test"
  }
}
